{
  "$schema": "https://json-schema.org/draft/2020-12/schema",
  "$comment": "Supported Plenact User Data Model versions: 1.0. Final specification; runtime integration is separately tracked.",
  "$id": "urn:plenact:user-data:1.0:asset",
  "title": "Portable asset metadata; no local paths, credentials or implicit upload endpoint",
  "type": "object",
  "properties": {
    "user_data_model_version": {
      "const": "1.0"
    },
    "payload_schema_version": {
      "const": 1
    },
    "record_type": {
      "const": "asset"
    },
    "id": {
      "$ref": "urn:plenact:user-data:1.0:content-types#/$defs/uuid"
    },
    "workspace_id": {
      "$ref": "urn:plenact:user-data:1.0:content-types#/$defs/uuid"
    },
    "payload": {
      "type": "object",
      "properties": {
        "account_id": {
          "$ref": "urn:plenact:user-data:1.0:content-types#/$defs/uuid"
        },
        "kind": {
          "enum": [
            "image",
            "video",
            "audio",
            "drawing_original",
            "binary"
          ]
        },
        "mime_type": {
          "type": "string",
          "pattern": "^[a-z0-9][a-z0-9!#$&^_.+-]*/[a-z0-9][a-z0-9!#$&^_.+-]*$"
        },
        "original_name": {
          "anyOf": [
            {
              "type": "string"
            },
            {
              "type": "null"
            }
          ]
        },
        "content_state": {
          "enum": [
            "described",
            "unavailable"
          ]
        },
        "byte_length": {
          "anyOf": [
            {
              "type": "string",
              "pattern": "^(0|[1-9][0-9]*)$"
            },
            {
              "type": "null"
            }
          ]
        },
        "sha256": {
          "anyOf": [
            {
              "type": "string",
              "pattern": "^[0-9a-f]{64}$"
            },
            {
              "type": "null"
            }
          ]
        },
        "source_format": {
          "anyOf": [
            {
              "type": "string",
              "minLength": 1
            },
            {
              "type": "null"
            }
          ]
        },
        "derived_from_asset_id": {
          "anyOf": [
            {
              "$ref": "urn:plenact:user-data:1.0:content-types#/$defs/uuid"
            },
            {
              "type": "null"
            }
          ]
        },
        "source_created_at_utc": {
          "anyOf": [
            {
              "$ref": "urn:plenact:user-data:1.0:content-types#/$defs/utc_timestamp"
            },
            {
              "type": "null"
            }
          ]
        },
        "attribution": {
          "anyOf": [
            {
              "type": "object",
              "properties": {
                "provider": {
                  "type": "string",
                  "minLength": 1
                },
                "source_id": {
                  "type": "string",
                  "minLength": 1
                },
                "creator_name": {
                  "type": "string"
                },
                "creator_url": {
                  "anyOf": [
                    {
                      "$ref": "urn:plenact:user-data:1.0:content-types#/$defs/url"
                    },
                    {
                      "type": "null"
                    }
                  ]
                },
                "source_url": {
                  "$ref": "urn:plenact:user-data:1.0:content-types#/$defs/url"
                }
              },
              "required": [
                "provider",
                "source_id",
                "creator_name",
                "creator_url",
                "source_url"
              ],
              "additionalProperties": false
            },
            {
              "type": "null"
            }
          ]
        }
      },
      "required": [
        "account_id",
        "kind",
        "mime_type",
        "original_name",
        "content_state",
        "byte_length",
        "sha256",
        "source_format",
        "derived_from_asset_id",
        "source_created_at_utc",
        "attribution"
      ],
      "additionalProperties": false
    }
  },
  "required": [
    "user_data_model_version",
    "payload_schema_version",
    "record_type",
    "id",
    "workspace_id",
    "payload"
  ],
  "additionalProperties": false
}
