{
  "user_data_model_version": "1.0",
  "payload_schema_version": 1,
  "record_type": "asset",
  "id": "30000000-0000-4000-8000-000000000015",
  "workspace_id": "20000000-0000-4000-8000-000000000001",
  "payload": {
    "account_id": "30000000-0000-4000-8000-000000000001",
    "kind": "binary",
    "mime_type": "application/octet-stream",
    "original_name": null,
    "content_state": "unavailable",
    "byte_length": null,
    "sha256": null,
    "source_format": null,
    "derived_from_asset_id": null,
    "source_created_at_utc": null,
    "attribution": null
  }
}
